entry_id,project_name,app_name,app_url,institution_url,product_website,summary,title,topic_id
,RoundBeat,"Disclaimer You may not use the Canton name, logo, or any other Canton trademark in, or as part of, your product or service name. BRAND GUIDLINES: RoundBeat",,,,": RoundBeat is a SaaS platform that provides real-time, external monitoring for multiple blockchain validators across multiple networks, starting with Canton. It gives operators full visibility into uptime, missed rounds, validator version status, and balance levels. Users can set custom alerts — fo",New Featured App Request: RoundBeat,116143950
,"Guffey, Inc.","Disclaimer You may not use the Canton name, logo, or any other Canton trademark in, or as part of, your product or service name. BRAND GUIDLINES: ACME Lend",,,,": ACME Lend is a decentralized, overcollateralized lending platform built on the Canton Network that enables users and institutions to lend, borrow, and manage digital assets securely within a permissioned blockchain environment. The platform supports: - Creation of new lending markets for supported","New Featured App Request: Guffey, Inc.",116124874
,FDF Technologies,: Tokino,,,,": Tokino is envisioned as a foundational building block for DeFi on the Canton Network. Its mission is to provide a core utility for token holders through an accessible token locking mechanism. By locking their Canton Coin (CC), participants are incentivized to hold their assets, which contributes t",New Featured App Request: FDF Technologies,115915419
,Emscote Arden Solutions FZC,: Registerlabs,,,,": Register Labs – Compliance Platform A blockchain-enabled compliance platform for managing and verifying supplier documentation. Companies can request vendors to upload due-diligence files (such as ISO, insurance, and safety certificates) into secure AWS storage. Each upload or update automatically",New Featured App Request: Emscote Arden Solutions FZC,115855023
,HydraX,"Disclaimer You may not use the Canton name, logo, or any other Canton trademark in, or as part of, your product or service name. BRAND GUIDLINES: Metra (by HydraX)",,,,": Our platform, built on the Canton Network (DAML), modernizes the initial book building for tokenized asset offerings. The system facilitates Issuer onboarding and asset tokenization, initiating the offering. Investors participate by securing commitments through a controlled Deposit action. Funds a",New Featured App Request: HydraX,116114026
,ANGELHACK PTE. LTD.,"Disclaimer You may not use the Canton name, logo, or any other Canton trademark in, or as part of, your product or service name. BRAND GUIDLINES: Kairo",,,,": Kairo is a Decentralised Exchange (DEX) housed on Canton Network. It offers RFQ-based swaps for trading of all native digital assets that exist on Canton Network. Built and powered by DAML smart contracts , Kairo provides a unified, secure, and highly flexible trading environment, making complex D",New Featured App Request: ANGELHACK PTE. LTD.,116112982
,"Modulo Labs, Inc.","Disclaimer You may not use the Canton name, logo, or any other Canton trademark in, or as part of, your product or service name. BRAND GUIDLINES: Modulo",,,,": Provide a summary of what your application will do: Modulo is principally comprised of two parts: 1. A multichain self-custody wallet 2. A cross-chain protocol layer that enables lending, borrowing, swapping, levered trading, prediction markets, and more At launch, Modulo supports EVM, SVM, and Ca","New Featured App Request: Modulo Labs, Inc.",116107202
,OpenVector,: Zoro Wallet,,,,: Zoro wallet is a non-custodial & native canton wallet that relies on external party IDs. It runs on any web browser on both mobile and desktop. Allows for sending and receiving of Canton Coins and eventually will support tokens adhering to the token standard.,New Featured App Request: OpenVector - Zoro Wallet,115954716
,Thetanuts Asset Corp,"Disclaimer You may not use the Canton name, logo, or any other Canton trademark in, or as part of, your product or service name. BRAND GUIDLINES: Thetamarkets",,,,": Thetamarkets is a decentralized options platform that enables yield generation through DeFi Option Vaults (DOVs). Users deposit digital assets into managed vault strategies—including covered calls, cash-settled puts, and wheel strategies—to earn sustainable yield from option premiums. The platform",New Featured App Request: Thetanuts Asset Corp,116101179
,Flipside Crypto,"Disclaimer You may not use the Canton name, logo, or any other Canton trademark in, or as part of, your product or service name. BRAND GUIDLINES: Confirmed. We will not use the Canton name or logo in product branding beyond required attribution.",,,,": FlipsideAI’s Canton Module delivers AI-driven on-chain analytics for Canton. It lets validators and ecosystem partners query Canton data via chat, view validator metrics, and analyze flows such as token movement and bridge activity. It helps Canton participants understand network activity and earn",New Featured App Request: Flipside Crypto,116055961
,PeerTrust Ltd,: PeerTrust,,,,": PeerTrust is an HR credential platform that lets organisations collect, track, and prove staff work-readiness: right-to-work, background checks, licences, qualifications, immunisations, and safety training. Files stay private in encrypted storage, while a tamper-evident proof is anchored to the Ca",New Featured App Request: PeerTrust Ltd,115874334
,Cypherock,: Cypherock Wallet,,,,": Its support of Canton network on the Cypherock hardware wallet, self custodian that relies on external party IDs. The users can send/receive Canton coins and other tokens that adhere to the token standard. This also covers support on the cySync app (both desktop and mobile) and a web wallet throug",New Featured App Request: Cypherock,115831007
,Zodia Custody,Zodia Custody,,,,,New Featured App Request: Zodia Custody,116047093
,Alpha DNA Private Ltd,"Disclaimer You may not use the Canton name, logo, or any other Canton trademark in, or as part of, your product or service name. BRAND GUIDLINES: Unhedged",,,,: Unhedged is a decentralized prediction market platform built on the Canton Network. It introduces a time-weighted rewards mechanism that incentivizes early participation and accurate forecasting in binary and multiple-choice markets. By using smart contract-based escrow and eliminating pooled bets,New Featured App Request: Alpha DNA Private Ltd,116033481
,pixelplex,"Disclaimer You may not use the Canton name, logo, or any other Canton trademark in, or as part of, your product or service name. BRAND GUIDLINES: Console Wallet",,,,": Console is a self‑custodial browser wallet for the Canton network. It covers the basics first: store, send, and receive tokens with clear fees. Keys stay on your device with passkeys. Connect to apps with a familiar web3 flow. You see what the app asks for. You review the details and fees. You app",New Featured App Request: pixelplex,116031194
,OpenVector,OpenVector,,,,,New Featured App Request: OpenVector,116053946
,Opus 28,"Disclaimer You may not use the Canton name, logo, or any other Canton trademark in, or as part of, your product or service name. BRAND GUIDLINES: OpusAccess",,,,: Provide tokenized access to investment opportunities,New Featured App Request: Opus 28,116017197
,Excellar International SAC Ltd.,": Excellar – Bermuda-regulated, yield-bearing tokens denominated in dollars, bitcoin, and other cryptocurrencies, along with related applications.",,,,": Excellar issues regulated yield-bearing tokens (xlTokens) on Canton denominated in BTC, ETH, and USD etc. We're the first Bermuda-licensed platform bringing institutional-grade Bitcoin and dollar yields to Canton Network, enabling enterprises, institutions, PSPs, and DeFi protocols to earn complia",New Featured App Request: Excellar International SAC Ltd.,115789035
,The Ching Labs Ltd.,: DeSyn Protocol,,,,": DeSyn Protocol provides a modular vault infrastructure that allows participants to create, manage, and operate tokenized vaults for liquidity and yield strategies. It simplifies access to complex DeFi opportunities by transforming them into intuitive, structured products that drive participation a",New Featured App Request: The Ching Labs Ltd.,115704000
,Staketab,: CantonGo Data App,,,,": CantonGo is a featured analytics and infrastructure platform on the Canton Network, offering a number of unique features like metahub name service, app directory, ecosystem hub, and powerful data insights, designed to enhance network transparency, validator performance, and ecosystem growth. It op",New Featured App Request: Staketab,115791283
,DTEAM,"Disclaimer You may not use the Canton name, logo, or any other Canton trademark in, or as part of, your product or service name. BRAND GUIDLINES: Transparent Scan",,,,": v1 Transparent Scan is a live app built for validators and users within the Canton ecosystem. It forms a structured marketplace where validators can offer RPС access, and users can connect to these endpoints through a paid subscription. This model allows validators to monetize their infrastructure",New Featured App Request: DTEAM,115997255
,Foundinals Lab,"Disclaimer You may not use the Canton name, logo, or any other Canton trademark in, or as part of, your product or service name. BRAND GUIDLINES: Canton Faucet",,,,": The Canton Faucet is a free testnet/devnet/main token dispenser for the Canton Network, a privacy-enabled blockchain interoperability protocol developed by Digital Asset. It allows developers, testers, and enthusiasts to request small amounts of test/real tokens to experiment with smart contracts,",New Featured App Request: Foundinals Lab,115992614
,Traffic Infrastructure Ltd,: Canton Finance is a decentralized stablecoin and yield protocol built on the Canton Network.,,,,": Canton Finance is building the first Asia-based, compliant on-chain yield and asset issuance platform on the Canton Network. Our platform enables users to deposit and over-collateralize digital assets — such as $USDT, $USDC, and $BTC — to mint $USDA (Asian USD), a network-native stable asset desig",New Featured App Request: Traffic Infrastructure Ltd,115970731
,pixelplex,: CantonView by pixelplex,,,,": CantonView is a full-featured blockchain explorer built for the Canton Network. It allows users to explore transactions, contracts, parties, and network activity in real time. The platform provides powerful search, filtering, and visualization tools designed to improve transparency, monitoring, an",New Featured App Request: pixelplex,115929012
,Ninteen26 Ltd,: PropNotary,,,,": PropNotary – Trusted Document and Professional Verification Network PropNotary is a blockchain-enabled verification platform designed to bring integrity and traceability to professional document verification. It allows authorised professionals (lawyers, surveyors, accountants, consultants) to atte",New Featured App Request: Ninteen26 Ltd,115926384
,Noders LLC,: UnitedApp,,,,": United App consists of: - Deepdive into Canton Network and Ecosystem library of all apps and projects - Canton Educational Academy (articles, videos, learning tools) - Advanced intelligence and insights - Useful resources for developers - Canton AI assistant - Platform for ambassador campaigns/hac",New Featured App Request: Noders LLC,115916749
,Sekoya Labs,: Canton Watch,,,,": Canton Watch provides real-time transaction monitoring and push notifications via Telegram for Canton Network accounts. Users add their accounts and receive instant, formatted alerts for transfers, validator rewards, and app rewards directly on their mobile devices or laptops. This eliminates the ",New Featured App Request: Sekoya Labs,115796386
,Five North,: 5N ID,,,,": A unified credential management platform for the canton network. We build a ""login with canton"" functionality that allows all users to login with their external wallets to any canton application. On top of that, the application is responsible for sharing credentials between apps. For example, Alic",New Featured App Request: Five North,115363096
,Kaiko,Kaiko,,,,,New Featured App Request: Kaiko,115873905
,T,: RizeScore by T-RIZE,,,,": CantonScore leverages the Rizemind framework to calculate the Featured App Rank & Performance Score—an AI-driven system that objectively evaluates each Featured App’s contribution to network health by measuring activity stability, adoption growth, relationship mapping, and elasticity, the ratio be",New Featured App Request: T-RIZE Group,115864356
,McShane Consulting LLC,: Canton Treasury Connector,,,,": Canton Treasury Connector integrates Canton Network data directly into Slack, increasing financial transparency and reducing operational friction. The CTC integration enables treasury management functions for Canton ecosystem participants like automated cash positions, balance monitoring, payment ",New Featured App Request: McShane Consulting LLC,115847575
,AKASEC,: AKASCAN,,,,: CantonSecurity by AKASEC is a vulnerability scanning and pentesting service that strengthens the Canton ecosystem by providing organizations with advanced security capabilities. It helps increase the overall cyber resilience of the network and supports participants in meeting regulatory compliance,New Featured App Request: AKASEC,115841095
,OpenVector,: Canton Exchange by OpenVector,,,,: Canton Exchange by OpenVector is the 1st AMM on the Canton Network. It will allow users to trade native and bridged assets on Canton Network and earn for providing liquidity to these assets.,New Featured App Request: OpenVector,115801734
,Texture Capital Inc. (subsidiary of Texture Capital Holdings Corp.),: Texture Alternative Trading System (ATS),,,,: Texture Capital Inc is a subsidiary of Texture Capital Holdings and a FINRA member broker-dealer and operator of an SEC registered Alternative Trading System.Texture Transfer Services is a separate subsidiary that is an SEC-registered transfer agent. We operate a Canton validator and have integrat,New Featured App Request: Texture Capital Inc. (subsidiary of Texture Capital Holdings Corp.),115798521
,Texture Capital Holdings,: Texture Capital Offering Platform,,,,: Texture Capital Inc is a subsidiary of Texture Capital Holdings and a FINRA member broker-dealer and operator of an SEC registered Alternative Trading System.Texture Transfer Services is a separate subsidiary that is an SEC-registered transfer agent. Our unique U.S. regulatory status allows us to ,New Featured App Request: Texture Capital Holdings,115798271
,Macao Mining Company,: Pilot,,,,": Pilot by Macao Mining is an AI-powered co-pilot that transforms blockchain data into actionable intelligence. It delivers agentic insights, automates analysis, and coordinates secure on-chain actions—helping enterprises and individuals navigate and operate confidently across decentralized networks",New Featured App Request: Macao Mining Company,115704346
,Chainbridge Accounting & Advisory,: Canton Validator Tax Planner & Finance Hub,,,,": Chainbridge's Validator Tax Planner enables validators to calculate their validator revenue and accurately estimate their monthly revenue, realized gains, and tax liability based on their entity type and jurisdiction. The Tax Planner is the first tool in the Chainbridge Canton Finance Hub. Subscri",New Featured App Request: Chainbridge Accounting & Advisory,115703548
,Fairmint,": CantonOps - Explorer for App builders and Validators (transaction, customer activity, analytics, app rewards, validator rewards...)",,,,": A complete analytics and operations suite for the Canton Network, CantonOps enables validators & app builders to manage their nodes, monitor their transactions, traffic & activity, and track in details their rewards (app, validator) with full transparency & actionable insights.",New Featured App Request: Fairmint,115649182
,Bitsafe,: Extension of the CBTC token decentralized-party app,,,,": CBTC is a 1:1 wrapped Bitcoin token by BitSafe, designed for secure and decentralized bridging to the Canton Network. Each CBTC is CIP-56 compliant, and is fully backed by Bitcoin held in a secure, decentralized custody system powered by FROST (Flexible Round-Optimized Schnorr Threshold Signatures",New Featured App Request: Bitsafe,115636367
,"Profitr, Inc.",: Profitr,,,,": We partner with leading private lenders to offer investors access to best-in-class, fully-funded, structured, performing loans. Profitr tokenizes private credit instruments on Canton.","New Featured App Request: Profitr, Inc.",115576007
,Towler Enterprises,: FlowRyd,,,,"Flowryd is a network intelligence and workflow orchestration application that accelerates on-chain market formation. It uses agentic insights to automate analysis for any participant to discover their network “DNA” using their unique position in the network to recommend complementary participants, a",New Featured App Request: Towler Enterprises,115540610
,Mandalo Inc,: Mandalo,,,,": Mandalo is a financial platform for people in high-inflation economies to save in USD, invest in U.S. stocks and crypto, and spend locally with a Visa card. It has integrated financial education to empower users to build lasting wealth",New Featured App Request: Mandalo Inc,115496473
,M1 Global,M1 Global,,,,,New Featured App Request: M1 Global,115397089
,Digital Asset,: USDC Bridge,,,,": Digital Asset, in partnership with Circle, are developing, deploying and operating a bridge between USDC on Ethereum and a wrapped USDC token on Canton Network. This bridge forms the basis to allow USDC to be deposited on Ethereum and a wrapped equivalent be created on Canton Network, or conversel",New Featured App Request: Digital Asset - Bridge Operator for USDC,115433697
,Zodia Custody,: Zodia Custody,,,,": Zodia Custody is the bank-bred digital asset custodian and infrastructure provider. With respect to the Canton blockchain, Zodia provides institutional custody and infrastructure services such that clients holding Canton Coin or tokens issued on Canton using CIP-56 have the option to pay their inv",New Featured App Request: Zodia Custody,115416465
,Node Fortress,: Canton Network Explorer,,,,": The Canton Network Explorer is the most complete explorer for the Canton ecosystem, designed to become the reference point for users and applications. It provides live network data, API access, and will expand to indexed datasets, alerting, and monitoring capabilities.",New Featured App Request: Node Fortress,115387547
,Obligate AG,: Obligate,,,,": Obligate is a Swiss‑regulated platform enabling the issuance, distribution, and lifecycle management of tokenized bonds and structured products. On Canton, we will roll out real‑world assets (RWA) by bridging regulated debt capital markets into the network. Our app provides a compliant infrastruct",New Featured App Request: Obligate AG,115376931
,"Noves, Inc",: Canton Data App,,,,": Noves is building the Canton Data App to provide a simple API offering enriched and translated transaction data across Canton applications. This data is complete, accurate, and reconcilable, making it ideal for reporting scenarios. It can be deployed as a single tenant application, on premises, so","New Featured App Request: Noves, Inc",115351610
,Proof Group,: Canton Node,,,,": Canton Node is an API gateway hub for anyone looking to access the Canton blockchain. Through Canton Node, clients will have a streamlined way of accessing information and data on the Canton blockchain without having to run their own validator or whitelist to a Super Validator. This should be a hu",New Featured App Request: Proof Group,115213466
,Trakx SAS,: Trakx Crypto Tradable Indices (CTIs),,,,: The Trakx app lets users tokenize and trade Crypto Tradable Indices directly on the Canton Network,New Featured App Request: Trakx SAS,115179346
,Send,: Canton Wallet,,,,: Onboard users via Passkeys. Canton token standard p2p transfers and custody. Multisig interested parties.,New Featured App Request: Send,115109706
,Temple,Temple,,,,,New Featured App Request: Temple,115006409
,Tenkai GmbH,Tenkai GmbH,,,,,New Featured App Request: Tenkai GmbH,114988822
,Black Manta Capital Partners,Black Manta Capital Partners,,,,,New Featured App Request: Black Manta Capital Partners,114937743
,IPBlock LLC,IPBlock LLC,,,,,New Featured App Request: IPBlock LLC,114794792
,C7,C7,,,,,New Featured App Request: C7,114778783
,Cantor8/DigiK,Cantor8/DigiK,,,,,New Featured App Request: Cantor8/DigiK,114699319
,The Tie,The Tie,,,,,New Featured App Request: The Tie,114668538
,EquiTek LLC,EquiTek LLC,,,,,New Featured App Request: EquiTek LLC,114659953
,Five North,Five North,,,,,New Featured App Request: Five North,114578556
,Lukka,Lukka,,,,,New Featured App Request: Lukka,114576356
,Tradeweb,Tradeweb,,,,,New Featured App Request: Tradeweb,114550179
,BRIKLY INC.,BRIKLY INC.,,,,,New Featured App Request: BRIKLY INC.,114455693
,Obsidian Software LLC,Obsidian Software LLC,,,,,New Featured App Request: Obsidian Software LLC,114342645
,T,RIZE Group,,,,,New Featured App Request: T-RIZE Group,114309625
,Five North,Five North,,,,,New Featured App Request: Five North,113857858
,Lukka Inc.,Lukka Inc.,,,,,New Featured App Request: Lukka Inc.,113846026
,Coin Metrics,Coin Metrics,,,,,New Featured App Request: Coin Metrics,113833065
,DLC (BVI) Holdings Ltd,DLC (BVI) Holdings Ltd,,,,,New Featured App Request: DLC (BVI) Holdings Ltd,113821853
,MPCH,MPCH,,,,,New Featured App Request: MPCH,113700641
,Kaiko,Kaiko,,,,,New Featured App Request: Kaiko,113686400
,Dfns,Dfns,,,,,New Featured App Request: Dfns,113472368
,The Tie's Proposal to Feature a Second PartyID for App Scalability,The Tie's Proposal to Feature a Second PartyID for App Scalability,,,,,Featured App Request: The Tie's Proposal to Feature a Second PartyID for App Scalability,113448066
,"Fairmint, Inc.","Fairmint, Inc.",,,,,"New Featured App Request: Fairmint, Inc.",113241893
,Novaprime Innovations LLC,Novaprime Innovations LLC,,,,,New Featured App Request: Novaprime Innovations LLC,113266757
,Bron Foundation,Bron Foundation,,,,,New Featured App Request: Bron Foundation,112787885
,Copper Markets (Switzerland) AG CHE,477.629.838,,,,,New Featured App Request: Copper Markets (Switzerland) AG CHE-477.629.838,112450771
,Bitalpha dba Bitwave,Bitalpha dba Bitwave,,,,,New Featured App Request: Bitalpha dba Bitwave,112582865
,Dfns,Dfns,,,,,New Featured App Request: Dfns,112541379
,The Tie,The Tie,,,,,New Featured App Request: The Tie,111959462
,Chata Technologies Inc,Chata Technologies Inc,,,,,New Featured App Request: Chata Technologies Inc,111931451
